airline_sentiment,sentiment_confidence,text,clean_text
positive,1.0,@SouthwestAir you're my early frontrunner for best airline! #oscars2016,early frontrunner best airline ! oscar
negative,1.0,@SouthwestAir luggage delivery between 1-4am? Really? After I was told by midnight multiple times? Why lie? Crazy and bad business.,luggage delivery ? really ? tell midnight multiple time ? lie ? crazy bad business
positive,0.6593,@AmericanAir is rising like the sun at DCA this morning.  @NATCA members have the best view. #avgeek http://t.co/VAhdekVOKe,rise like sun dca morning member best view avgeek
neutral,1.0,"@JetBlue do they have to depart from Washington, D.C.??",depart washington c ? ?
negative,0.6625,@JetBlue I can probably find some of them. Are the ticket #s on there?,probably find ticket ?
neutral,0.6612,@united I would love if someone could get me back to Austin tonight and I do not wish to wait til tomorrow morning.,would love someone could get back austin tonight do_not_wish wait til tomorrow morning
negative,1.0,@AmericanAir Why did I have to stand at baggage claim for an hour waiting for a bag that you knew never made it on to the plane?,stand baggage claim hour wait bag know never_made plane ?
negative,1.0,@united this means within one week i will have filed 2 compensation complaints to your website,mean within one week file compensation complaint website
negative,0.6442,@SouthwestAir darn! I bought it on the wrong device! No way to switch I'm sure?,darn ! buy wrong device ! no_way switch sure ?
neutral,1.0,"@JetBlue Flight 1447 (N351JB) ""JBLU"" arrives at @FlyTPA following flight from Westchester County Airport http://t.co/xX2M2jxQep",flight n jb jblu arrive follow flight westchester county airport
negative,1.0,@USAirways I've been on hold to change a date on a ticket for over 3 hours. Can someone please assist me? Unacceptable.,hold change date ticket over hour someone please assist ? unacceptable
neutral,1.0,@JetBlue Flight 136 departed Phoenix at 1:30 am,flight depart phoenix
positive,0.6543,@AmericanAir Thx! I hope so. IAH to DFW to OKC has turned out to be a LONG trip today and I have to work tomorrow.,thanks ! hope so iah dfw okc turn out long trip today work tomorrow
neutral,0.6535,@SouthwestAir it was 3472,
negative,1.0,@AmericanAir 4th flight rebooked to is NOT Cancelled Flighted! Woo-hoo. Going to make it to @LaGuardiaAir,th flight rebooked is_not_cancelled flighted ! woo hoo go make
neutral,0.6584,@SouthwestAir do you have a pair of tickets to the @Imaginedragons show in Atlanta?! I'd love to go! #DestinationDragons,pair ticket show atlanta ? ! would love go ! destinationdragons
negative,0.6864,@AmericanAir refund,refund
negative,1.0,"@USAirways I cant make it to airport, roads are to bad in DFW and no one is answering the phones and the website is down?How do I reschedule",cannot_make airport road bad dfw no_one answer phone website down ? reschedule
negative,1.0,@JetBlue now we dont have enough money for parking in your garage this is your fault and im not paying for what should be 10mins into 3hrs,do_not_have enough money park garage fault not_paying min hrs
negative,1.0,@sarahpompei don't bother wasting your time!  @USAirways will send u a form letter &amp; let u choose a gift certificate. #worstcustomerservice,do_not_bother waste time ! send form letter amp let choose gift certificate worstcustomerservice
negative,1.0,@united once again your customer service rep was rude!   I asked a question and in turn got attitude.  Jane was no help.  Disgusted again!,customer service rep rude ! ask question turn get attitude jane no_help disgust !
negative,0.6653,@USAirways that you would let us just switch to a different set of flights so we could spend time with the family after he passes away...,would let u switch different set flight so could spend time family pass away
positive,0.6768,"@JetBlue OK, thank you.",ok thank
negative,1.0,@USAirways waited for 3 hours NO LUGGAGE line too long left airport when flight Cancelled Flighted WHERE does luggage GO? On hold for 1 hour so far,waited hour no_luggage line too long left airport flight cancel flighted luggage go ? hold hour so far
negative,1.0,@USAirways well that is not going to help. I'vebeen on hold over 3 hrs &amp; my client wants his ff nbr in the record he's elite wAA,well is_not_going help vebeen hold over hrs amp client want ff nbr record elite waa
positive,1.0,@SouthwestAir My Fav!!!!,fav ! ! ! !
positive,0.6804,"@JetBlue we have just landed, thank you anyway. Btw, flight staff on flight 654 were wonderful despite their full day and heavy load.",land thank anyway way flight staff flight wonderful despite full day heavy load
neutral,0.6749,@USAirways I didn't make a reservation yet. It's about changing name on my dividend miles account,did_not_make reservation yet change name dividend mile account
negative,0.6641,@SouthwestAir- is new #MKT strategy to be average like all the rest? #whathappend? RR Points Devalued- AGAIN -http://t.co/mDbDYomrs7,new mkt strategy average like rest ? whathappend ? rr point devalue
negative,1.0,"@AmericanAir no hold times, just disconnections.   There is no excuse for that",no_hold time disconnection no_excuse
negative,1.0,@USAirways 'preciate it but cant get off plane to speak w agent / wont come on plane 5015 knoxville...?,preciate cannot_get off plane speak w agent will_not_come plane knoxville ?
negative,0.6753,@AmericanAir I know your policy. Just asking for a little kindness due to extenuating circumstances.,know policy ask little kindness due extenuating circumstance
neutral,1.0,"@VirginAmerica Anytime, sugafly.",anytime sugafly
neutral,0.698,@united refund?,refund ?
negative,1.0,"@AmericanAir You've misunderstood. @USAirways WOULD NOT do a same day flight change for me. The gate agent said, ""NO.""",misunderstood would_not_do day flight change gate agent say no
negative,1.0,"@JetBlue we saw one, he was as useless as the tsa agents who inspected my shoes",saw one useless tsa agent inspect shoe
negative,1.0,"@united And then when we asked the stewardess to take the disinfectant wipe as trash she said, ""not with my hands!"" #badservice",ask stewardess take disinfectant wipe trash say not_with hand ! badservice
negative,1.0,"@AmericanAir 4285. Apparently we’re told, staff on the ground keep promising to come and they don’t.",apparently told staff ground keep promise come not
positive,1.0,@JetBlue you're still the best,still best
negative,1.0,"@USAirways: I relied on US Airways, and that was my mistake. Awful customer experience.",rely u airway mistake awful customer experience
negative,0.667,@AmericanAir my flight to DFW from LIT on my way to PDX tomorrow was Cancelled Flighted. Can you help me?,flight dfw light way pdx tomorrow cancel flight help ?
negative,1.0,@united an over booked flight to start with and a red eye from lax to bos with no reclining seat.... #lastflightwithyouever,over booked flight start red eye lax bos no_reclining seat lastflightwithyouever
positive,1.0,"@AmericanAir LTALJX, from DCA to OMA this morning. All of the staff that helped me fix my problem were so helpful. #goodthingscome #thanks",ltaljx dca oma morning staff help fix problem so helpful goodthingscome thanks
negative,0.6854,@united just filled it out. Hope someone responds before we book our next trip.,fill out hope someone respond book next trip
neutral,1.0,@SouthwestAir traditionally used sledge hammer - low $ taking share from driving | now scalpel approach through data science  #ANAmarketers,traditionally use sledge hammer low take share drive scalpel approach data science anamarketers
positive,1.0,@SouthwestAir thanks for the info and the quick response!,thanks info quick response !
negative,1.0,"@AmericanAir that would be appreciated. Just please don't send me to the same page with long form &amp; limited characters.
Direct email?",would appreciate please do_not_send page long form amp limit character direct email ?
positive,1.0,@united @reebok @rockinwellness @ Denver International Airport https://t.co/tKVmHBkeC3,denver international airport
negative,0.6421,"@united I appreciate the immediate offer, but suspect it is more long-term issue/not simple fix. Also, ski/bootbag policy is awkward at best",appreciate immediate offer suspect long term issue not_simple fix also ski bootbag policy awkward best
negative,1.0,"@JetBlue flt1533 to Carta what is goin on?! 1st told plane coming from hangar, then gate change, now no one knows wat plane we're getting on",flt carta goin ? ! st tell plane come hangar gate change no_one know wat plane get
negative,1.0,@united should contact me and the others on my flight who can't get their website to work. None of our info is valid! http://t.co/3zpJr7kWbk,contact others flight cannot_get website work none info valid !
neutral,0.6627,"@SouthwestAir my father was kind enough to offer to pay for a hotel, but I can't use this coupon if he pays from FL. no help?",father kind enough offer pay hotel cannot_use coupon pay fl no_help ?
negative,0.662,@VirginAmerica The Flight Booking Problems section of your website seems to be broken on Chrome. Might wanna look into that.,flight book problem section website seem broken chrome might want look
negative,1.0,@AmericanAir ahhhh your silence is golden now.  This tops it all.  Anyone get fired?,ahhhh silence golden top anyone get fire ?
negative,1.0,@united FAIL You Cancelled Flightled our flight frm GJT and then used our reserv home to IAH (from SEA) for reFlight Booking Problems w/out OUR PERMISSION!! #PH6RPS,fail cancel flightled flight frm gjt use reserv home iah sea reflight book problem w out permission ! ! ph rps
positive,1.0,"@JetBlue Very excited, for the first time this Sunday, March 1 I get to fly #JetBlue flight 123 #Mint from JFK. Looking forward :-)",very excited first time sunday march get fly jetblue flight mint jfk look forward
positive,1.0,@united thank you. I flew into Newark from Vail/Eagle.,thank fly newark vail eagle
neutral,1.0,@AmericanAir what is the status of flight 1675 tomorrow,status flight tomorrow
neutral,1.0,@SouthwestAir https://t.co/OQUKSo3s2O subscribe please https://t.co/OQUKSo3s2O,subscribe please
neutral,1.0,@JetBlue flight 705. EWR to FLL,flight ewr fll
negative,1.0,@SouthwestAir I've been on hold with customer service for over an hour. Can you help?!,hold customer service over hour help ? !
negative,1.0,@united says @USAirways  is the final carrier . Us air doesnt have it. I want my bag!!! Not a claim not an im  sorry. I want my clothes!!,say final carrier u air does_not_have want bag ! ! ! not_a claim not_an sorry want clothes ! !
neutral,1.0,@JetBlue  Alright I hope. My JetBlue app is showing a change in my seats and online shows an a320.  Don't want any surprises,alright hope jetblue app show change seat online show do_not_want surprise
neutral,1.0,"@JetBlue No, it's weird!! I picked other cities just to test, those worked...not the one I want. Works on phone though, so I'll use that.",no_it weird ! ! picked city test work not_the one want work phone though so use
neutral,1.0,@JetBlue Can I bring a compact folding chair like this in a checked bag? http://t.co/9nivw9ftZw,bring compact fold chair like check bag ?
negative,1.0,"@JetBlue appreciate what you've done on your end to make this right, but still unhappy with initial incident. Will be calling.",appreciate do end make right still unhappy initial incident call
positive,0.663,Is expiring the @united offer to buy or transfer #United #MileagePlus miles with discount? Many offers during a year http://t.co/6tz6imqZlG,expire offer buy transfer united mileageplus mile discount ? many offer year
negative,1.0,@JetBlue - trying to fly from BOS to JFK. Flight delayed. Traveling with kids. Book a hotel or are we getting out tonight?,try fly bos jfk flight delay travel kid book hotel get out tonight ?
negative,0.657,@AmericanAir ok makes no sense tho Since you'll give me a free upgrade to first.,ok make no_sense though since give free upgrade first
neutral,1.0,@VirginAmerica Atlantic ploughs a lone furrow in the #MiddleEast http://t.co/FVUdmh27pF @TheNationalUAE,atlantic plough lone furrow middleeast
neutral,1.0,@united can you please tell me where United flies to from Sydney Australia - pref Asia Pac or US as I have a voucher to redeem.,please tell united fly sydney australia pref asia pac u voucher redeem
neutral,1.0,His name is Enzo 😊 RT @JetBlue : @Setorii Well hello there pooch! What's your name? #dog http://t.co/dLh9138HBg,name enzo smiling_face_with_smiling_eyes rt well hello pooch ! name ? dog
negative,1.0,"@AmericanAir Cancelled Flights my flight, doesn't send an email, text or call. Now I'm stranded in Louisville.",cancel flight flight does_not_send email text call strand louisville
negative,0.6465,@JetBlue bag is supposedly here in Boston,bag supposedly boston
positive,1.0,Thank you “@united: @TRUU_Tall I can certainly take a look. Please follow and DM me your confirmation number for assistance. ^JH”,thank certainly take look please follow dm confirmation number assistance jh
negative,1.0,@united the drunk guy you threw out of flight UA936 4hrs ago is better off than the rest of us held up for 5hrs in the plane without food.,drunk guy throw out flight ua hr ago better off rest u hold up hrs plane without food
negative,0.7102,Why? 😒 RT @JetBlue Our fleet's on fleek. http://t.co/I7Ut2ZvHCO,? unamused_face rt fleet fleek
neutral,1.0,@VirginAmerica posts second consecutive full-year net profit - @ATWOnline http://t.co/tvB5zbzVhg,post second consecutive full year net profit
negative,1.0,@united Flight 2 is 2:30 hrs delayed so far b/c of Late Flight crew. Now we are literally waiting while they have dinner acc. to honest gate agent.,flight hr delay so far b c late flight crew literally wait dinner acc honest gate agent
negative,1.0,@AmericanAir that luggage you forgot...#mia.....he just won an oscar😄💝💝💝,luggage forget mia oscar grinning_face_with_smiling_eyes heart_with_ribbon heart_with_ribbon heart_with_ribbon
positive,0.6667,@JetBlue I'm #MakingLoveOutofNothingAtAll on my #brandloveaffair to #LAX https://t.co/kdHRUF54sW,makingloveoutofnothingatall brandloveaffair lax
negative,1.0,@USAirways @TheHaileyTate Another blatant lie from @USAirways,another blatant lie
negative,1.0,"@AmericanAir seems like queue times are very high, in Q waiting for an agent 4 almost  an hour.Flight got Cancelled Flightled. http://t.co/sDm2wvR3zr",seem like queue time very high q wait agent almost hour flight get cancel flightled
negative,1.0,@USAirways Not only did u lose the flight plan! Now ur flight crew is FAA timed out! Thx for havin us sit on the tarmac for an hr! #Pathetic,not_only lose flight plan ! flight crew faa time out ! thanks havin u sit tarmac hr ! pathetic
neutral,0.656,"@united can I get on a stand by list from ASE to ORD? I'm the only poor person in Aspen, that's why I'm asking for standby on twitter.",get stand list ase ord ? poor person aspen ask standby twitter
positive,0.6748,@SouthwestAir Thanks.,thanks
negative,0.6701,"@SouthwestAir There is no option just to Cancelled Flight? I don't want to change flight, I want to Cancelled Flight.",no_option cancel flight ? do_not_want change flight want cancel flight
negative,1.0,"@united still missing my luggage, was promised someone would call, no call so far, flight from Shanghai to DC with connecting flight in ORD",still miss luggage promise someone would call no_call so far flight shanghai dc connect flight ord
negative,1.0,@USAirways I was completely ripped of by US Airways today never fly this airline  I am contacting my local news,completely rip u airway today never_fly airline contact local news
negative,1.0,"@SouthwestAir where are our bags?
We have a tv show to film!!",bag ? tv show film ! !
negative,1.0,"@USAirways @united two broken airplanes, two days Late Flightr and I'm stranded after a funeral and missing out on my last semester of #college. 👍",two broken airplane two day late flightr strand funeral miss out last semester college thumbs_up
neutral,0.6421,@USAirways any plans to support #ApplePay on board? I have the USAirways MC and it would be nice to still use it if I forget the card.,plan support applepay board ? usairways mc would nice still use forget card
negative,1.0,@AmericanAir employees are racist!!!!!,employee racist ! ! ! ! !
negative,0.6667,@USAirways My flight cost me just under $800 and this is what happens? I fly with @united and have no problems. I come the US 4-5 times...,flight cost happens ? fly no_problems come u time
neutral,1.0,@united still waiting for a response on whether or not you allow use of a rear facing car seat on an ERJ145.,still wait response whether not_you allow use rear face car seat erj
negative,1.0,@SouthwestAir oh look you just delayed our flight an additional half hour now arriving at 6 officially five hours after planned. 😡😡😡😡😤😤😤,oh look delay flight additional half hour arrive officially five hour plan enraged_face enraged_face enraged_face enraged_face face_with_steam_from_nose face_with_steam_from_nose face_with_steam_from_nose
negative,1.0,"@USAirways delayed 2.5 hours @longbeachairport trying to get to @PHXSkyHarbor; give us an update, please???",delay hour try get give u update please ? ? ?
neutral,0.6492,@JetBlue Thank you.,thank
positive,0.6771,@jetblue thanks,thanks
negative,1.0,@USAirways - I wouldn't need to wait on hold for 6+ hours if your website worked correctly - please respond!,would_not_need wait hold hour website work correctly please respond !
negative,1.0,@SouthwestAir I was trying to find airfare for my family.  Your prices are ridiculous!  Almost $1000 more than @USAirways. #notmadeofmoney,try find airfare family price ridiculous ! almost notmadeofmoney
negative,1.0,@AmericanAir yes there's issues on the site as well unfortunately.,yes issue site well unfortunately
negative,1.0,"@USAirways @nburnside26  U hate delays, too?  But u have her $$ &amp; are holding her hostage!  #GoingForGreatnessFAIL",hate delay too ? amp hold hostage ! goingforgreatnessfail
negative,1.0,"@united what you did was illegal and a breach of contract. I will be in touch but not through your ""customer feedback""",illegal breach contract touch not_through customer feedback
negative,0.663,@united no I don't. Spoke with baggage contact at 1-800 number. Said they will try to get bags to stay at IAD for pick up tmrw,no_i do_not_spoke baggage contact number say try get bag stay iad pick up tomorrow
positive,1.0,@JetBlue thank you for getting me home. And despite all odds I have reunited with my delinquent Southwest luggage. Now homeward,thank get home despite odds reunite delinquent southwest luggage homeward
positive,0.7012,@JetBlue sooo earlier i said i couldnt fly with you for my school trip but now i can! 😏,sooo earlier say could_not_fly school trip ! smirking_face
neutral,0.6667,"@JetBlue i'm getting info from the website, but needing to check it and the alerts would be much more beneficial.",get info website need check alert would much beneficial
negative,1.0,@united sat at airport for 5 hrs still sitting at gate..  Sigh,sat airport hr still sit gate sigh
neutral,0.6906,"@AmericanAir I sent you a DM, can you please help.",sent dm please help
negative,1.0,@USAirways strikes again...lost bags. And two of them. #theworst,strike lose bag two theworst
neutral,1.0,"@VirginAmerica Beats EPS Views, Takes On #SouthwestAir VA LUV - Investor's Business Daily http://t.co/FLwmGDAHxu",beat eps view take southwestair va love investor business daily
negative,0.6927,"@USAirways I fly quite a bit, and it's not difficult to communicate. If agents let people know what's happening, arrangements can be made",fly quite bit is_not_difficult communicate agent let people know happen arrangement make
negative,1.0,@AmericanAir westjet and your rep won't do anything about my lost luggage- which I never even checked with westjet because it was lost in,westjet rep will_not_do anything lose luggage never_even check westjet lost
negative,1.0,@USAirways Thanks for Cancelled Flighting my flight tomorrow and not reFlight Booking Problems me on another one. #usairwaysfail,thanks cancel flight flight tomorrow not_reflight book problem another one usairwaysfail
positive,1.0,@USAirways thank you!!,thank ! !
negative,1.0,@united landed at 9:40pm and have been standing waiting for bags that were loaded plane side..why isn't the crew here#tiredcustomer,land pm stand wait bag load plane side is_not_the crew tiredcustomer
negative,0.3437,"@SouthwestAir thank you : 8UXZJ2
Paid for early bird and sat in back",thank uxzj pay early bird sit back
negative,1.0,“@united: @rikrik__ What made you come to this? Can we help you with anything? ^JP” the service just hasn't been great.,make come ? help anything ? jp service has_not_been great
negative,1.0,"@united the hotel you sent us to wouldnt take the voucher. Our flight was delayed, then Cancelled Flightled, then delayed again. 32 hours and counting",hotel send u would_not_take voucher flight delay cancel flightled delayed hour count
negative,1.0,@united that link is not helpful as it does not put me In touch with management,link is_not_helpful does_not_put touch management
negative,1.0,@JetBlue U say our safety is our highest priority but that doesn't extend 2 our property? This is totally nuts. http://t.co/xZY7pHKFGR,say safety highest priority does_not_extend property ? totally nut
negative,1.0,@JetBlue u suck Big Donkey Balls!,suck big donkey ball !
positive,1.0,@USAirways Shout out to the red-headed gate agent for flt 3389 from DCA to CHS at 7:10 tonight. Didn't get her name but she was great!,shout out red headed gate agent flt dca chs tonight did_not_get name great !
negative,1.0,"@united. Please get me an economy plus seat. Awful day of 2 Cancelled Flighted flights, after lots of planning.",please get economy plus seat awful day cancel flighted flight lot plan
neutral,0.6511,@united hey I left my favorite blanket on the plane bring it back home to me:-(,hey leave favorite blanket plane bring back home
negative,1.0,"@AmericanAir @JimDayTV no, you couldn't care less. That's why their customer service is run by bots",no_you could_not_care less customer service run bot
negative,1.0,"@united It was Cancelled Flightled, none of the passengers were notified. Complete violation of travelers' rights.  @AerocivilCol",cancel flightled none passenger notify complete violation traveler right
negative,1.0,"@united yes, computer would allow me to get to San Diego quick but customer service will not help.  Says can't rebook http://t.co/KcVUbUYExc",yes computer would allow get san diego quick customer service will_not_help say cannot_rebook
negative,1.0,@USAirways pretty sure we didn't actually take off at 7:10 http://t.co/vuxf4r4Unu,pretty sure did_not_actually take off
negative,1.0,@united Ugh.  My bags were sent to Palm Springs and not to LAX as promised.  They better be at the hotel when I get there.,ugh bag send palm spring not_to lax promise better hotel get
negative,1.0,@united 2nd time in a row  I've been over charged by 100's of $$ on my plane ticket WHY? #united I shouldn't have to check my CC everytime,nd time row over charge plane ticket ? united should_not_have check cc everytime
negative,0.6309,@united flying tomorrow from mexico to US. Mileage tkts dont show 1k status. Help,fly tomorrow mexico u mileage tkts do_not_show k status help
neutral,1.0,@JetBlue selfie on the flight 83 from #JFK to #Orlando . With @Supertzar85 http://t.co/QRANZImHTr,selfie flight jfk orlando
negative,1.0,"@USAirways @ClaudOakeshott don't need this link, after getting a person u now say u don't know where bags are. Lost on a nonstop phx to jfk.",do_not_need link get person say do_not_know bag lose nonstop phx jfk
negative,1.0,@USAirways Youre batting .1000. Every flight Ive taken is delayed. Worst airline. ever.,bat every flight take delayed worst airline ever
negative,1.0,@united is the stingiest airline. Nobody should model after them. #PTFO #cheap #bastards #stingy,stingiest airline nobody model ptfo cheap bastard stingy
positive,1.0,@USAirways on a happy note our 719 crew is wonderful. Can't say enough great things about our pilot. He's doing all he can for us.,happy note crew wonderful cannot_say enough great thing pilot u
negative,1.0,@united On flight 1712 to Houston delayed duecto engine trouble. Willl you hold my connection to Argentina at Houston since I'm Late Flight now?,flight houston delay duecto engine trouble willl hold connection argentina houston since late flight ?
negative,1.0,@united #worst2unitedflightsever UA1429 IAD to LAS 2/19 mechanical problems - switched aircraft delayed 3.5 hours!,worst unitedflightsever ua iad la mechanical problem switch aircraft delay hour !
negative,1.0,@united if I pay you $25 and $35 for my luggage to be delivered when I arrive. Why should I have to wait 3 additional days for its delivery?,pay luggage deliver arrive wait additional day delivery ?
negative,1.0,@SouthwestAir why are you literally the worst?,literally worst ?
negative,1.0,@USAirways who do we voice our concerns to when we can't get home with our 8 month old after waiting to taxi to a gate for 3 hours?,voice concern cannot_get home month old wait taxi gate hour ?
neutral,1.0,@SouthwestAir When does PV get approved? I am ready to go!!,pv get approve ? ready go ! !
neutral,1.0,"@AmericanAir oh I will, AA on speed dial",oh aa speed dial
negative,1.0,"@AmericanAir just Cancelled Flightled my 7 am flight tomorrow with out informing me at all today, then booked one in 2 days, and no customer service",cancel flightled flight tomorrow out inform today book one day no_customer service
neutral,0.6714,@USAirways good ideas...she is traveling today...at airport.  Need to petition faa regarding silly 24 name change rule.,good idea travel today airport need petition faa regard silly name change rule
