airline_sentiment,sentiment_confidence,text,clean_text
negative,1.0,@AmericanAir You sent me a cheque today which can’t be paid into a UK bank account. VERY annoying!,sent cheque today cannot_be pay uk bank account very annoy !
negative,1.0,@SouthwestAir very disappointed in your handling of tonight's Cancelled Flighted Dallas flight.  Not that it was Cancelled Flighted but no contingencies.,very disappointed handle tonight cancel flighted dallas flight not_that cancel flighted no_contingencies
negative,0.6405,@JetBlue I would like to send an email to Lost and Found at JetBlue JFK; I spoke to them this morning but cannot drive their today.,would like send email lose find jetblue jfk speak morning cannot_drive today
negative,0.6421,@united we are never going to get to out gate at this rate.,never_going get out gate rate
positive,1.0,"@SouthwestAir, I really appreciate you all's #BHM commercial that aired today during @BET's #BookofNegroes",really appreciate bhm commercial air today bookofnegroes
negative,1.0,@AmericanAir that's absolutely horrible customer service. The person supposed to call me can't immediately call back when disconnected???,absolutely horrible customer service person suppose call cannot_immediately call back disconnect ? ? ?
negative,1.0,"@USAirways No, they won't because after 5 hours of holding I had to give up because I couldn't borrow the phone any longer. 5 hours...",no_they will_not_because hour hold give up could_not_borrow phone longer hour
neutral,0.7047,@united same flight number different flight. I'm heading to MPLS,flight number different flight heading mpls
negative,1.0,@JetBlue ill call in the morning. too upset right now.,ill call morning too upset right
negative,1.0,@AmericanAir it's not just frustrating--it was PAID for! how do we get a refund?,is_not_just frustrating pay ! get refund ?
negative,1.0,@AmericanAir Is large Wichita Falls Airport not receiving any arrivals? I have called and no one answers. I been waiting for 1 day,large wichita fall airport not_receiving arrival ? call no_one answer wait day
negative,0.6728,@JetBlue just a very rude rep while trying to book family vacation using trvl credit. on phone w/ new rep now who is being very helpful,very rude rep try book family vacation use trvl credit phone w new rep very helpful
negative,1.0,@JetBlue exactly why is my flight delayed? 599 BDL to DCA? Can't seem to get an answer,exactly flight delay ? bdl dca ? cannot_seem get answer
negative,1.0,"@SouthwestAir used to love you, but you keep rescheduling my flights.  #southworst",use love keep reschedule flight southworst
negative,1.0,@AmericanAir you have the worst reps at Jacksonville airport. So rude and totally not helpful at all!,worst rep jacksonville airport so rude totally not_helpful !
negative,1.0,@SouthwestAir Don't apologize. Do something about it. Words mean nothing. Actions work. EOM.,do_not_apologize something word mean nothing action work eom
neutral,0.6655,@united just called and did it. Should have earlier because I'm being sent to DCA first and THEN to pvd. We may rent a car instead.,call earlier sent dca first pvd may rent car instead
neutral,1.0,@JetBlue Lekvhg want to see what the cost would be to change to the 430 flight,lekvhg want see cost would change flight
positive,1.0,@AmericanAir I love your company and your staff is amazing. They just made an uncomfortable situation comfortable,love company staff amaze make uncomfortable situation comfortable
positive,0.6906,"@SouthwestAir stewardess really funny! Now I could get the gent next to me to use some headphones, this would be the perfect flight!",stewardess really funny ! could get gent next use headphone would perfect flight !
positive,1.0,@USAirways ok thank you! Very helpful! This is why you're my favorite airline!,ok thank ! very helpful ! favorite airline !
negative,1.0,@united Do we know why UA5282 is delayed x2)? This is getting crazy. I've already had 2 overnight delays. #UnitedAirlines,know ua delay x ? get crazy already overnight delay unitedairlines
positive,1.0,@SouthwestAir Looking forward to flying once again with #SWA on Friday! The #LUV airline. #DTW #MDW #TUS,look forward fly swa friday ! love airline dtw mdw tus
negative,0.6506,@AmericanAir Okay... If someone does it look for it now my fear is it will be lost forever. It's a very small item.,okay someone look fear lose forever very small item
positive,0.6669,@JetBlue thanks...,thanks
negative,1.0,@united yes still need assistance I don't have a flight home due to change in flight u made I miss all connections !,yes still need assistance do_not_have flight home due change flight make miss connection !
neutral,1.0,@JetBlue Do you have any flights with lie flat seating from STL to PDX on or around the date of March 5?,flight lie flat seating stl pdx around date march ?
negative,0.7018,@JetBlue the gate agent said our original plane got de-icing fluid in the engine that created a short so they took the plane out of service,gate agent say original plane get de ice fluid engine create short so take plane out service
positive,1.0,"@JetBlue okie doke! Knowing you, you will fix this ;)",okie doke ! know fix
negative,1.0,@USAirways seriously!!!  Flight Cancelled Flighted. Auto rebooked to Tuesday??? Then 3hr 26min on hold for nothing. Renting car. Want refund!!!!,seriously ! ! ! flight cancel flighted auto rebooked tuesday ? ? ? hr min hold nothing rent car want refund ! ! ! !
negative,1.0,@USAirways incapable of seating a 2yo and mom together. Toddler in his own row #fail @CNN,incapable seat yo mom together toddler row fail
neutral,1.0,"@JetBlue CEO weighs profits, flyers - @ChronicleHerald (registration) http://t.co/l2n0egHdgn",ceo weigh profit flyer registration
negative,1.0,@USAirways citizen. I fly your airline constantly and am so offended.  Derrick Bussey. Now Im crying on this airplane because I'm so upset,citizen fly airline constantly so offended derrick bussey cry airplane so upset
neutral,0.6667,@USAirways Don't want to clog your already-crowded line with a special meal request. Can someone DM me to sort out? #vegetarianproblems :),do_not_want clog already crowd line special meal request someone dm sort out ? vegetarianproblems
negative,1.0,@united how can you never got a flight from austin to Houston in time for a connection ever? Ever!,never_got flight austin houston time connection ever ? ever !
negative,1.0,@JetBlue I understand but wish you would have announced the delay 2 hours earlier vs sitting for 2 hrs at MCO,understand wish would announce delay hour earlier vs sit hr mco
negative,1.0,@SouthwestAir I've had TERRIBLE service in three airports in 10 hours. Glad they don't care we kind of need to be home. #SellMyPointsSoon,terrible service three airport hour glad do_not_care kind need home sellmypointssoon
positive,1.0,@SouthwestAir a nice trip back home after a looong vaca 😊🌴 http://t.co/9TRvfnCedL,nice trip back home looong vaca smiling_face_with_smiling_eyes palm_tree
negative,1.0,@SouthwestAir Hi I just got a message that part of my flights is Cancelled Flightled. I can't rebook online and nobody answers my phone call. Help me,hi get message part flight cancel flightled cannot_rebook online nobody answer phone call help
negative,1.0,@SouthwestAir hello. my flight is Cancelled Flightled for #destinationdragons and no one at your desk at KCI knows what the fuck is happening!!!!!!!!,hello flight cancel flightled destinationdragons no_one desk kci know fuck happen ! ! ! ! ! ! ! !
negative,1.0,@USAirways @stephenrodrick Your team needs to build capacity,team need build capacity
negative,1.0,@united Not fast enough.  No excuse for service between big hubs to have such outdated craft. Southwest has wifi. This is awful.,not_fast enough no_excuse service big hub outdated craft southwest wifi awful
negative,1.0,@JetBlue Why was flight 669 forced to return to NY when there was a malfunction? Why not land in the countless air strips surrounding Chi?,flight force return ny malfunction ? not_land countless air strip surround chi ?
negative,1.0,@AmericanAir Or u cud answer my ? here! 140 is plenty. Inflight stealing going on right now &amp; FA won't have the uncomfortable convo w pass.,cud answer ? ! plenty inflight steal go right amp fa will_not_have uncomfortable conversation w pas
neutral,1.0,@USAirways with chocoLate Flight please... i m melting http://t.co/jJdoSFYIBM,chocolate flight please melt
negative,1.0,@USAirways please fix your reservations phone system.  The weather/backup could not possibly be bad for 10 days!  #goodgriefpeople,please fix reservation phone system weather backup could_not_possibly bad day ! goodgriefpeople
negative,0.6867,"@AmericanAir but don't you worry... @Delta took good care of me... Your loss, their gain.",do_not_you worry take good care loss gain
negative,1.0,"@southwestair Cancelled Flightling flights due to winter weather is totally understandable, but it would sure be nice if you would answer your phones.",cancel flightling flight due winter weather totally understandable would sure nice would answer phone
positive,0.6525,@USAirways  Lilly M in SJU check in is fabulous!,lilly sju check fabulous !
negative,1.0,@JetBlue what's up with the broken tv in seat 6F on flight 1818 today? Planned to catch the @cavs game!!! Nooooo,up broken tv seat f flight today ? plan catch game ! ! ! nooooo
neutral,1.0,@JetBlue Challenge accepted. First 5 crew members to send pics in the chairs get FREE tickets to visit us. #wager #IsItSummerYet,challenge accept first crew member send pic chair get free ticket visit u wager isitsummeryet
negative,1.0,@AmericanAir @hoagy10 how about you stop cutting and pasting apologies and get some additional phone reps to do their jobs,stop cut paste apology get additional phone rep job
negative,1.0,"@VirginAmerica a lot of ""apologies"" being thrown out to customers from what I can see.Very sad. Thanks for nothing. Worst airline ever.",lot apology throw out customer see very sad thanks nothing worst airline ever
negative,1.0,@AmericanAir thnkx bt dont help now we will need to go WAY out of OUR way to get where we NEED to be for the $ u charge this sux #neveragain,thnkx bt do_not_help need go way out way get need charge suck neveragain
negative,0.6677,Thanks. “@USAirways: @fispahani Weather disruptions have caused some of our crew to run Late Flight. We're sorry for the delay to your flight.”,thanks weather disruption cause crew run late flight sorry delay flight
neutral,0.6733,"Aww, is it? @JetBlue I guess now I need to book a flight to somewhere warm ASAP! Any suggestions?",aww ? guess need book flight somewhere warm soon possible ! suggestion ?
negative,1.0,@SouthwestAir turned my non-stop flight between Laguardia/dal into a 1 stop in STL. WTH? I'm thinking some sorta comp is in order? REALLY?,turn non stop flight laguardia dal stop stl wth ? think sorta comp order ? really ?
negative,1.0,"@USAirways We did. @AmericanAir said to open one with you, too.",say open one too
negative,1.0,@USAirways always fun to get screwed out of an earlier flight (that isn't full) #crummyservice #whydidntiflysouthwest #goodluckamericanair,always fun get screw out earlier flight is_not_full crummyservice whydidntiflysouthwest goodluckamericanair
negative,1.0,"@AmericanAir The website won't let me view my reservation due to ""changes made outside http://t.co/nwF2FkA8fY"". I'm on hold now to get help.",website will_not_let view reservation due change make outside hold get help
negative,1.0,@SouthwestAir When will the flight resume? I don's see it in the open schedule. :/,flight resume ? see open schedule
positive,1.0,"@JetBlue I flew to San Francisco from Fort Lauderdale with you last year, had a fantastic time so would like to go back !",flew san francisco fort lauderdale last year fantastic time so would like go back !
negative,1.0,"@USAirways @garywerk poor excuse. I was towards front of plane, no sandwiches, we have to pay for them, should have more",poor excuse towards front plane no_sandwiches pay
negative,1.0,@united is the worst http://t.co/27aitZl6nd,worst
negative,1.0,@USAirways you see now that is a lie.  They auto respond with insulting email. #sucks,see lie auto respond insult email suck
positive,0.671,@AmericanAir - keeping AA up in the Air! My crew chief cousin Alex Espinosa in DFW! http://t.co/0HXLNvZknP,keep aa up air ! crew chief cousin alex espinosa dfw !
positive,1.0,"@united Flew ORD to Miami and back and  had great crew, service on both legs. THANKS",flew ord miami back great crew service leg thanks
negative,1.0,"@united agent Rick Clifton in SEA-HOU , told him my father is dying and needed to get my handbag on the cabin. he did nothing #shameful",agent rick clifton sea hou tell father die need get handbag cabin nothing shameful
negative,1.0,"@USAirways @usairways -Really? U land me in Philly 1.5 hours before my flight, wait 1.5 hours behind a plane you got stuck,",really ? land philly hour flight wait hour behind plane get stuck
negative,1.0,@AmericanAir how nice it would be if you had helpful flight attendants instead of the rude nasty ones you employ. #WhyAreYouYelling,nice would helpful flight attendant instead rude nasty one employ whyareyouyelling
neutral,0.662,@USAirways have scheduled flight Sat(2morrow) CHO-CLT CHO needs to be added to weather advisory.  Please evaluate asap.,schedule flight sat morrow cho clt cho need added weather advisory please evaluate soon possible
neutral,0.71,"@AmericanAir daughter record loc. is KYBILC. She is traveling with 3 y.o. and needs to be in adjacent seats, not across isle.",daughter record loc kybilc travel need adjacent seat not_across isle
negative,1.0,@SouthwestAir when will sw return to customer service?  Business travelers made sw now sw ignores us.,sw return customer service ? business traveler make sw sw ignores u
negative,0.6515,@united So what does someone with severe anxiety do when the one person who can help him isn't next to him?,so someone severe anxiety one person help is_not_next ?
negative,1.0,@USAirways got this message on your site to call about my flight - just gave up after being on hold for 3 HOURS! http://t.co/5cDX2ROAE6,get message site call flight give up hold hour !
neutral,1.0,.@AmericanAir just disappointed with the Flight Booking Problems process and add’l fees to sit together on a more crowded flight. Not impressed so far :-/.,disappointed flight book problem process add l fee sit together crowd flight not_impressed so far
neutral,0.6876,@SouthwestAir would love Tix for Velour show-entered every contest and still haven't won :(,would love tix velour show enter every contest still have_not_won
negative,1.0,@united searched for mileage tickets to BOM couldn't find a single one is saver awards - I see how you play.  Earn miles but can't use them.,search mileage ticket bom could_not_find single one saver award see play earn mile cannot_use
negative,1.0,@JetBlue I've spoken 2/emailed JB team and explained situation. Didnt seem to matter to anyone other than me. I guess I just expected more.,speak emailed jb team explain situation did_not_seem matter anyone guess expect
negative,0.6667,@united received hotel but no food.  Also email for 3750 miles.  Last trip had 3 hr delay and 5000 miles - so less for Cancelled Flightlation?,receive hotel no_food also email mile last trip hr delay mile so less cancelled flightlation ?
neutral,1.0,@SouthwestAir landing early morning @BWI_Airport after snowfall. http://t.co/apRZsPxigE,land early morning snowfall
neutral,0.681,@JetBlue everyone is overreacting. Keep up your swag!,everyone overreact keep up swag !
negative,0.7033,"@USAirways after being assured by the pleasant woman at gate B11 in Albany, NY that life's not perfect, I'd heard enough.",assure pleasant woman gate b albany ny life not_perfect would hear enough
positive,0.6522,@VirginAmerica when are you putting some great deals from PDX to LAS or from LAS to PDX show me your love! http://t.co/enIQg0buzj,put great deal pdx las la pdx show love !
negative,1.0,"@united No, I need you guys to not over book planes. It's not a concern, I'll just travel with someone else moving forward.",no_i need guy not_over book plane is_not_a concern travel someone else move forward
negative,1.0,@SouthwestAir Have been on hold to reschedule a flight for 1.5 hours! Please help! Phone will be out of batteries soon.,hold reschedule flight hour ! please help ! phone out battery soon
neutral,0.6657,@united Any news about the departure of the flight UA51?,news departure flight ua ?
negative,1.0,@USAirways No kidding. Oy.,no_kidding oy
negative,1.0,@USAirways Uh yeah. Flight boarded &amp; now 1 hr Late Flightr we still sit. Update on 4435 to DCA?,uh yeah flight board amp hr late flightr still sit update dca ?
positive,1.0,@AmericanAir excellent!  Love you guys!  If it is first class I'll hug ya'll!  See you shortly!,excellent ! love guy ! first class hug ya ! see shortly !
negative,0.6843,@USAirways not too impressed with your airlines but I would feel a lot better flying with if you upgraded me up to first class tomorrow,not_too impressed airline would feel lot better fly upgrade up first class tomorrow
negative,0.6452,"@united Such as deodorant, shampoo, toothpaste. Seems like that would be limited to 70oz, correct?",deodorant shampoo toothpaste seem like would limit oz correct ?
neutral,0.3451,@USAirways we got our bags today. Thanks!,get bag today thanks !
positive,0.6816,@JetBlue I can't wait to hear back from you regarding the internship opportunity! 😊,cannot_wait hear back regard internship opportunity ! smiling_face_with_smiling_eyes
neutral,1.0,@AmericanAir just downloaded the app for iPhone.  Notice drink coupon but nothing is displayed?  Getting ready to fly...,download app iphone notice drink coupon nothing display ? get ready fly
negative,1.0,"@USAirways This is garbage, been trying to book a reward flight and then it got Cancelled Flighted and still can't get anyone on phone. Unacceptable",garbage try book reward flight get cancel flight still cannot_get anyone phone unacceptable
negative,1.0,@SouthwestAir when you're on hold with southwest for over 2 hours and it automatically hangs up on you. #iusedtoloveu http://t.co/tEFHpuWMdJ,hold southwest over hour automatically hang up iusedtoloveu
negative,1.0,@USAirways that's it?!?!?,? ! ? ! ?
neutral,1.0,@SouthwestAir I am but it says yall are sold out. Me &amp; My coworkers would need to get out first available,say sell out amp coworkers would need get out first available
negative,1.0,@AmericanAir I filled out that whole form before receiving a poor poor response. Is there no direct email address in reply?,fill out whole form receive poor poor response no_direct email address reply ?
negative,1.0,@JetBlue Is today's JetBlue Flight 918 (NYC-&gt;BOS) delayed? My app says on time and the website says it's not...,today jetblue flight nyc gt bos delay ? app say time website say not
negative,1.0,@usairways if you could change your name to @southwestair and do what they do...that'd be awesome. Also this plane smells like onion rings.,could change name would awesome also plane smell like onion ring
negative,0.6789,"@AmericanAir arrived +-10pm eastern. Had to deplane on the CRJs airstairs to an icy Tarmac. Valet bags sent to carousel, so it was 10:20pm.",arrive pm eastern deplane crjs airstairs icy tarmac valet bag sent carousel so pm
negative,1.0,@united of course. But interesting how United doesn't seem to have a good sense on what's happening with flight,course interest united does_not_seem good sense happen flight
neutral,0.6646,@AmericanAir when will you be issuing a weather advisory for RDU?? the entire state of NC has shut down from the overnight winter storm.,issue weather advisory rdu ? ? entire state nc shut down overnight winter storm
negative,1.0,@USAirways From here on out when I can at all I'm flying @Delta. Since when is a plane getting stuck in a drift for 2 hours a weather issue?,out fly since plane get stuck drift hour weather issue ?
neutral,1.0,@JetBlue Phew!! Did it!! (Pant. Wheeze) http://t.co/ZPZ78POeON,phew ! ! ! ! pant wheeze
neutral,0.6429,@united keep me updated. Let me know that the bags make the flight to j-burg,keep updated let know bag make flight j burg
positive,1.0,@SouthwestAir Thank you for taking good care of people with ALS! http://t.co/m1yyWAFkFI @KevinSwan_ @ALSTDI @A_Life_Story_,thank take good care people al !
negative,1.0,@USAirways now on hold with customer care.  Wonder if someone will pick up the phone before 5pm.,hold customer care wonder someone pick up phone pm
negative,1.0,@USAirways started trying to reach a real person over an hour ago still no luck,start try reach real person over hour ago still no_luck
negative,1.0,"@united Now arriving a day and a half Late Flightr than supposed to. Lesson of the day, don't believe verbal or written confirmations from United",arrive day half late flightr suppose lesson day do_not_believe verbal write confirmation unite
negative,1.0,@AmericanAir Close down,close down
negative,1.0,"@AmericanAir Just called regarding my bag, came in yesterday and no one notified more or updated the online record locator #customerservice",call regard bag come yesterday no_one notify updated online record locator customerservice
negative,1.0,"@USAirways Cancelled Flightled flight this AM. There was avail flight to PHL today u said was sold out. I had to buy 2nd ticket, u need to refund me.",cancel flightled flight avail flight phl today say sell out buy nd ticket need refund
negative,1.0,"@VirginAmerica All of group E was told there was no more room in the bins. when I got on the plane, was room for at least 4 bags in my row!",group e tell no_more room bin get plane room least bags row !
negative,1.0,"@united - so they changed depart from 1:45 to 2:00pm &amp; it is now 1:40pm &amp; the Capt. just got off the plane to find a smoothie, 2pm my ass!!!",so changed depart pm amp pm amp capt get off plane find smoothie pm as ! ! !
positive,1.0,"@SouthwestAir Another great flight &amp; crew, Las Vegas-Chicago #3397. Thanks!",another great flight amp crew las vegas chicago thanks !
positive,1.0,@AmericanAir thanks so much!,thanks so much !
neutral,1.0,@southwestair watching planes do their thing https://t.co/iItoJhUIKH,watch plane thing
negative,1.0,"@united no commitment to a good turnaround, an operations mgr would have counted a dozen small issues with individual performance",no_commitment good turnaround operation mgr would count dozen small issue individual performance
negative,1.0,@united has the WORST customer svcs! This Kevin rep at call center must be investigated. My baggage's lost and there's no help but argument!,worst customer svcs ! kevin rep call center must investigate baggage lose no_help argument !
neutral,0.6414,"@united After all I have been through on this trip, can you get me on another airline home?",trip get another airline home ?
positive,1.0,@SouthwestAir Thank you for having flights going out of Nashville! You guys Rock! #DisneyPrincessHalfMarathon #girlsweekend #bffs,thank flight go out nashville ! guy rock ! disneyprincesshalfmarathon girlsweekend bffs
negative,0.3763,@SouthwestAir when will airfare be available through December of this year? I have 2 major trips coming up and I'm anxious to book them!,airfare available december year ? major trip come up anxious book !
positive,1.0,@united thanks we'll be in touch!,thanks touch !
negative,0.6957,@united They couldn't get me first class on any of their flights so I just rebooked myself.,could_not_get first class flight so rebooked
negative,1.0,@united thanks finally made it.. Missed meetings but what can I do now?,thanks finally make missed meeting ?
neutral,0.6803,@USAirways how long is that flight? http://t.co/bCwckWtnlE,long flight ?
neutral,1.0,BLOCK ME BIKE RT @JetBlue: Our fleet's on fleek. http://t.co/2z3hGqPRSG,block bike rt fleet fleek
negative,1.0,"@united I guess you have to ""follow"" me in order for me to send you a DM.. I tried and it won't send.",guess follow order send dm try will_not_send
negative,1.0,@united the Premier desk was able to rebook me with our friends at @AmericanAir. Only problem is now I have to pay for a checked bag :/,premier desk able rebook friend problem pay check bag
negative,0.66,"@SouthwestAir Why do airlines change ticket prices in the middle of the day
#annoyed",airline change ticket price middle day annoy
positive,1.0,@USAirways Shavon at customer service desk in Charlotte was fantastic! So helpful and smiling evn after what sounds like long day.Reward her,shavon customer service desk charlotte fantastic ! so helpful smile evn sound like long day reward
negative,1.0,@AmericanAir you can tweet but not call! You're like a bad boyfriend!,tweet not_call ! like bad boyfriend !
neutral,0.6314,@SouthwestAir companion pass please!,companion pas please !
neutral,1.0,@AmericanAir flight BA1551 departing tomorrow (wednesday) - not Cancelled Flightled but how can anyone make it to the airport in this weather?,flight ba depart tomorrow wednesday not_cancelled flightled anyone make airport weather ?
positive,0.9236,@AmericanAir Thank you.....you do the same!!,thank ! !
negative,1.0,@AmericanAir I have filed multiple complaints. I prefer to continue warning the public instead of wasting more time with this inhumane corp.,file multiple complaint prefer continue warn public instead waste time inhumane corp
positive,1.0,@JetBlue thanks for your prompt response. I know you put safety first. Unfortunately will hit freezing rain/sleet on ride home.,thanks prompt response know put safety first unfortunately hit freeze rain sleet ride home
neutral,1.0,@JetBlue it's time for our #brandmance 2 go #UpWhereWeBelong https://t.co/KtAWbiUUro,time brandmance go upwherewebelong
