airline_sentiment,sentiment_confidence,text,clean_text
negative,0.6955,@SouthwestAir got a text my flight was Cancelled Flightled! Now what do I do :/?? Help please!!!,get text flight cancel flightled ! ? ? help please ! ! !
negative,1.0,@USAirways You guys are screwing up my trip. Thanks for nothing. #lazy,guy screw up trip thanks nothing lazy
negative,1.0,@united Thanks for the vague canned response that doesn't address the issue!,thanks vague can response does_not_address issue !
positive,1.0,@JetBlue You definitely will!,definitely !
positive,1.0,@JetBlue thanks! Calling right now!,thanks ! call right !
negative,1.0,@JetBlue I just submitted feedback for you @gripeo. Not a good way 2 handle baggage or customers: http://t.co/F6COpX1Fvj,submit feedback not_a good way handle baggage customer
positive,1.0,@united thanks for the epic service on 863- always a pleasure- outstanding crew http://t.co/trqlpeinzW,thanks epic service always pleasure outstanding crew
positive,0.6803,@VirginAmerica I don’t use Passbook =/ I still love you though &lt;3 :) I’ll just use my email in the future.,do_not_use passbook still love though lt use email future
negative,1.0,@JetBlue hopefully this flight Seattle to Boston 2pm will have wifi. Our first one did not and we had to entertain ourselves! #lizaapproved,hopefully flight seattle boston pm wifi first one did_not_and entertain ! lizaapproved
negative,1.0,@JetBlue Shocked by misbehavior and cheap comments from jet airways staff to passenger at Delhi Airport Friday boarding to Dubai. Disgusting,shock misbehavior cheap comment jet airways staff passenger delhi airport friday board dubai disgusting
neutral,0.6876,"@united are you looking for European Flight attendants for Paris or Frankfurt?

Best, 

Fabrice",look european flight attendant paris frankfurt ? best fabrice
positive,0.3482,@VirginAmerica come back to #PHL already. We need you to take us out of this horrible cold. #pleasecomeback http://t.co/gLXFwP6nQH,come back phl already need take u out horrible cold pleasecomeback
negative,1.0,.@united in the future when delay causes 15 hour wait (slept night in airport) ensuring seating choice for replacement flight would be good.,future delay cause hour wait sleep night airport ensure seat choice replacement flight would good
negative,1.0,"@USAirways Your ""moveup"" policy really sucks. United has a 24 hour policy for this with status. I was wanting to move up from 5am to 7am...",moveup policy really suck united hour policy status want move up
negative,0.3469,@USAirways thank you for reaching out to me. Hopefully my request will be fixed and I can remain a loyal customer.,thank reach out hopefully request fix remain loyal customer
negative,1.0,@USAirways It's very difficult to work with Baggage claims when they don't answer the phone,very difficult work baggage claim do_not_answer phone
neutral,1.0,@USAirways I have a flight in Saturday from MCI to CLT and there's heavy snow predicted in MCI. When will u allow for changes?,flight saturday mci clt heavy snow predict mci allow change ?
negative,0.6628,"@united - tick, tock, tick, tock, it is rapidly approaching the next dream departure of 1:45pm. When is the next fantasy departure time??",tick tock tick tock rapidly approach next dream departure pm next fantasy departure time ? ?
positive,1.0,@VirginAmerica Moodlighting is the only way to fly! Best experience EVER! Cool and calming. 💜✈ #MoodlitMonday,moodlighting way fly ! best experience ever ! cool calm purple_heart airplane moodlitmonday
positive,1.0,@JetBlue Awesome thanks! Thanks for the quick response. You guys ROCK! :),awesome thanks ! thanks quick response guy rock !
neutral,1.0,@JetBlue can I switch my seat for my trip on Sunday?,switch seat trip sunday ?
positive,0.6768,@united Thanks - it's very helpful to understand that the reduced price seats that are sold at check-in have priority over the certificates.,thanks very helpful understand reduce price seat sell check priority over certificate
positive,1.0,@USAirways no problem.  Things worked out at airport.   Thanks!,no_problem thing work out airport thanks !
positive,1.0,@SouthwestAir Thank you. Great tool,thank great tool
negative,1.0,"@USAirways Can't stress enough how awful the agent was for flight 5283. Knew 11 ppl from delayed flight were on way in mins, no compassion.",cannot_stress enough awful agent flight know people delay flight way mins no_compassion
positive,1.0,@JetBlue here in Austin I saw the water bottles &amp; snacks @ the desk for your waiting passengers! Im so Flight Booking Problems my next flight with you!,austin saw water bottle amp snack desk wait passenger ! so flight book problem next flight !
neutral,1.0,@united In Ethiopia adopting a child.  Need flight home from ADD to GRR Late Flight 2/27 or very early 2/28. (need to change existing reservation),ethiopia adopt child need flight home add grr late flight very early need change exist reservation
negative,1.0,@AmericanAir a phone call or email when you Cancelled Flight a flight would be lovely.,phone call email cancel flight flight would lovely
negative,0.6765,"@AmericanAir and it gets better...other passengers rebooked direct on other airlines. #whereisthelove 
#whybeAAFF?",get better passenger rebooked direct airline whereisthelove whybeaaff ?
negative,1.0,@AmericanAir has been almost a month and still no response to my online complaint/questions. Out $300 because of it.,almost month still no_response online complaint question out
negative,1.0,"@united poor showing today, no assistance to passengers who mis connected due to maintenance and waiting for baggage",poor show today no_assistance passenger mis connect due maintenance wait baggage
neutral,1.0,Need more info on that! @united: @momsgoodeats We have great amenity kits. PJ's not included. We status match AA. ^KP”,need info ! great amenity kit pj not_included status match aa kp
negative,1.0,"@SouthwestAir my sinuses had to contend with two painful landings rather than one, and we missed a preregistration window. Beyond frustrated",sinus contend two painful landing rather one miss preregistration window beyond frustrated
positive,0.6593,@AmericanAir my return flight is scheduled on Wednesday; AA138 I believe.  Thanks for the help!,return flight schedule wednesday aa believe thanks help !
negative,1.0,@SouthwestAir almost bumped me off my flight to HRL when I was 20 minutes early then your staff was rude when I asked what was the problem?,almost bump off flight hrl minute early staff rude ask problem ?
negative,1.0,@USAirways Need to talk to a person about my bag. Waiting on hold for two hours. Bag s!b delivered last night. Online says not found.,need talk person bag wait hold two hour bag ! b deliver last night online say not_found
neutral,1.0,"@SouthwestAir Ahhhh! Sorry, just followed.",ahhhh ! sorry follow
neutral,0.6735,@JetBlue I would love to Fort Lauderdale now that would cool.,would love fort lauderdale would cool
neutral,0.6516,"@USAirways Is it possible to earn Dividend Miles for a passenger that is not me, even if I am purchasing the tickets?",possible earn dividend mile passenger is_not_me even purchase ticket ?
neutral,0.6809,@americanair I sure do. I'm running version 3.10.0,sure run version
negative,1.0,@JetBlue any info on why flight 704 from SJU to JFK is already delayed 2 1/2 hours?,info flight sju jfk already delay hour ?
neutral,1.0,@JetBlue by any chance do u offer fresh guacamole on your flights,chance offer fresh guacamole flight
neutral,1.0,@SouthwestAir how are flights looking for tomorrow morning from #Nashville (BNA) to Fort Lauderdale (FLL) ?!,flight look tomorrow morning nashville bna fort lauderdale fll ? !
negative,1.0,@united error message said couldn't process request at the last step after seat selection on each leg. Agent was unaware of an (1 of 2),error message say could_not_process request last step seat selection leg agent unaware
negative,1.0,@AmericanAir . Death of a dear friend has me heart broken but #AmericanAirlines has me heated!,death dear friend heart break americanairlines heat !
negative,0.7171,@united a report was filed with the airport police on 11th and 12th February-I have the police case number if required,report file airport police th th february police case number require
negative,0.6722,@SouthwestAir done messed up now!!! I have planned a trip to #CostaRica for pennies!!! #VacaTime ✈️💺,do mess up ! ! ! plan trip costarica penny ! ! ! vacatime airplane seat
neutral,1.0,@AmericanAir What happens when you combine Top Chef &amp; the beauty of San Miguel de Allende. My Late Flightst food blog.  http://t.co/7t1rDRCRe6,happens combine top chef amp beauty san miguel de allende late flightst food blog
negative,1.0,@united U BUMS HOW DO U LOSE THE BIGGEST BAG ON THE FLIGHT,bum lose biggest bag flight
negative,1.0,@united hey! DM not working. UA 307!,hey ! dm not_working ua !
neutral,0.6845,"@SouthwestAir I have a flight to Vegas coming up soon, but haven’t received any drink tickets Late Flightly. Can you help me out?",flight vega come up soon have_not_received drink ticket late flightly help out ?
negative,1.0,"@SouthwestAir humor aside, we've been stuck on the plane for two hours at the gate because bags can't be loaded correctly. What gives?",humor aside stick plane two hour gate bag cannot_be load correctly give ?
positive,1.0,@SouthwestAir I WOULD DO ANYTHING FOR tickets to the VEGAS... ANYTHING. I love imagine dragons so much!!,would anything ticket vegas anything love imagine dragon so much ! !
negative,1.0,@SouthwestAir there's an hour wait here for reFlight Booking Problems in line at Omaha.,hour wait reflight book problem line omaha
neutral,1.0,@JetBlue Ok and in Dominican Republic what numbers?,ok dominican republic number ?
negative,0.6642,"@united nexus confirmed that at any crossing via air, car or boat she can travel with only Nexus.",nexus confirm cross via air car boat travel nexus
negative,0.7069,@united no it weighed 45.5 and it was the only checked bag,no_it weigh check bag
negative,1.0,@united If you have had any issues with  United Airlines PLEASE retweet. Paid for a full fight ticket and was given a standby instead.,issue unite airline please retweet pay full fight ticket give standby instead
negative,0.6906,@SouthwestAir not letting me DM. # is FSZ4YO,not_letting dm fsz yo
negative,1.0,@SouthwestAir finally boarded. Looks like I'll make it to my final destination but my baggage won't # baggagefail #bagsflyfreebutnotwithme,finally board look like make final destination baggage will_not_baggagefail bagsflyfreebutnotwithme
positive,1.0,@JetBlue I was so excited when I saw that you fly there! #ionlyflyblue,so excited saw fly ! ionlyflyblue
negative,1.0,"@AmericanAir i tried all day. Have been disconnected due to ""heavy call volume.""",tried day disconnect due heavy call volume
negative,1.0,@United so you jacked out my cousins trip to Portland and then Cancelled Flightled her return trip?! No more United,so jack out cousin trip portland cancel flightled return trip ? ! no_more united
negative,0.67,@SouthwestAir now I'm so lucky for my forced good deed I get to be smashed between 2 huge ppl in the exit row. Thank God I'm tiny. 😂💁,so lucky force good deed get smash huge people exit row thank god tiny face_with_tears_of_joy person_tipping_hand
neutral,1.0,"@SouthwestAir Is there any way to add a Known Traveler Number to an existing reservation online?  If not, why not?",way add know traveler number exist reservation online ? not_why not ?
neutral,1.0,@united any updates with the DOT looking at the united fares from London to the US from last week?,update dot look united fare london u last week ?
negative,0.6389,"@AmericanAir when will there be wifi on the DCA-STL route?  2 hour flight, could use some love!",wifi dca stl route ? hour flight could use love !
negative,1.0,"@AmericanAir Your AA3465 staff are refusing to allow a woman to board. She was here at 8 for 8:16 departure. Sign still ""Now Boarding""...",aa staff refuse allow woman board departure sign still board
neutral,0.6667,@SouthwestAir @PHLAirport Will Flight 2155 that arrives at E11 be a penguin plane?,flight arrive e penguin plane ?
negative,1.0,@USAirways at which point in told they have sold my voucher because I wasn't fast enough,point tell sell voucher was_not_fast enough
neutral,0.6639,@JetBlue @BucketObolts Same,
neutral,0.6632,“@JetBlue: Our fleet's on fleek. http://t.co/cRFrwpc1Sx”😂😂😂,fleet fleek face_with_tears_of_joy face_with_tears_of_joy face_with_tears_of_joy
negative,1.0,@SouthwestAir took our BOS to BWI plane for a flight to StL and promised a replacement  1.5 hours Late Flightr. Now 2.5 hours delayed. Not happy.,take bos bwi plane flight stl promise replacement hour late flightr hour delay not_happy
negative,1.0,@USAirways so disappointed. Least you could do is give us access to admirals club for an hour before our flight to our wedding!,so disappointed least could give u access admiral club hour flight wedding !
negative,0.7125,@SouthwestAir when and why was flight 4471 from MSP Cancelled Flighted this AM?,flight msp cancel flight ?
neutral,0.6582,@JetBlue minutes to spare.,minute spare
negative,1.0,@AmericanAir I DMed you my AA &amp; phone #s &amp; you can't have someone call me? What was the point of your response? You didn't resolve anything!,dmed aa amp phone amp cannot_have someone call ? point response ? did_not_resolve anything !
negative,1.0,@USAirways duh on baggage claim 2 more hours and counting .. Flights 622 &amp; 1898 http://t.co/DkZl57uPQI,duh baggage claim hour count flight amp
negative,1.0,@USAirways / @AmericanAir are incompetent.,incompetent
negative,1.0,@USAirways @traveloneworld .. Utterly frustrated after 4 hours on hold call was disconnected. I need to amend a Flight Booking Problems. HELP! OW Emerald,utterly frustrate hour hold call disconnect need amend flight booking problem help ! ow emerald
neutral,1.0,@JetBlue wants Customs at Long Beach Airport for future international flights. By @EricBradleyPT http://t.co/J6Hb4JDvER cc: @BrianSumers,want custom long beach airport future international flight cc
negative,1.0,@AmericanAir DM me and I can explain the whole story. I should have been on an earlier flight not US1937,dm explain whole story earlier flight not_us
negative,1.0,@united Flight Cancelled Flightled to BDL and stranded @Dulles_Airport. Waiting almost 2hrs at customer service. Shout out to diligent agents.,flight cancel flightled bdl strand wait almost hrs customer service shout out diligent agent
negative,1.0,@united so the last seg of my flight from Denver (DEN) to hayden/steamboat (HDN) for 8am got Cancelled Flightled and I need help finding my luggage,so last seg flight denver den hayden steamboat hdn get cancel flightled need help find luggage
neutral,1.0,@JetBlue are @AskAmex Amex Plat holders provided access or a credit in the Airspace Lounge in JKF?,amex plat holder provide access credit airspace lounge jkf ?
negative,0.6765,@united that would have been nice earlier  today. Too Late Flight now. I hope.,would nice earlier today too late flight hope
negative,0.6948,@SouthwestAir not very helpful trying to get out of Nashville.Should waive change fee for 2/18.,not_very helpful try get out nashville waive change fee
negative,1.0,"@USAirways his name is Rett Cavan, he has a gofundme page, and is going to take his last breath tonight. This airline only cares about money",name rett cavan gofundme page go take last breath tonight airline care money
neutral,0.688,@USAirways no problem...just funny have a nice day,no_problem funny nice day
negative,1.0,"@united 3 hrs searching for flts, find 1 on site &amp; can't book the $ offered bc 1 seg isn't really available. #lies #falseadvertising",hr search flts find site amp cannot_book offer seg is_not_really available lie falseadvertising
negative,1.0,@JetBlue I did not report the updated info - don't know how to reach them without a super long wait on hold at your main number.,did_not_report update info do_not_know reach without super long wait hold main number
negative,1.0,"@united 2100$ ticket,12h biz trvl,no wifi.Missed con flt,next one#24h,missed meeting,7$ food voucher,hotel chkout#12,flt#5,no wifi#hotel",ticket h biz trvl no_wifi miss con flt next one h miss meeting food voucher hotel chkout flt no_wifi hotel
negative,1.0,"@united Arriving 25 minutes early is nice, but not if equipment isn't ready. Waiting 30 minutes for luggage, so far. Time gains wiped out.",arrive minute early nice not_if equipment is_not_ready wait minute luggage so far time gain wipe out
negative,1.0,@AmericanAir I remained on hold for 2 hrs to resolve my flight schedule &amp; your system hung up on me. #unhappycustomer,remain hold hr resolve flight schedule amp system hang up unhappycustomer
negative,0.67,"@united Freakin""",freakin
positive,1.0,"Thank you United! “@united: @dan_roam That's a beautiful place to stay a day longer. Have you been re-booked? If not, let me know. ^MN”",thank united ! beautiful place stay day longer book ? not_let know mn
neutral,0.3494,@JetBlue I have more flights that I'd love to redeem for some points but they're a little over a year old. Is there a historical limit?,flight would love redeem point little over year old historical limit ?
negative,0.6737,"@JetBlue @martysg you *know* how I love you, JB, but honestly, when you have complex feedback, those pull-down sub-option forms=maddening.",know love jb honestly complex feedback pull down sub option form madden
negative,1.0,@SouthwestAir Any plans to implement a call-back system on your reFlight Booking Problems line? Been on hold for over an hour now...,plan implement call back system reflight book problem line ? hold over hour
negative,0.6513,@AmericanAir Hi AA ! I placed an itin on hold to expire on 2/27.Just logged into my acct..its gone! Seat hasn't been released to inv. Help?,hi aa ! place itin hold expire log account go ! seat has_not_been release inv help ?
neutral,0.6447,@SouthwestAir how can customers get in touch with you internationally from Mexico for lost baggage,customer get touch internationally mexico lose baggage
negative,0.6897,@AmericanAir on Feb. 15th your rep gave me the record locator and told me I'd be receiving an email with the itinerary and confirmation.,february th rep give record locator tell would receive email itinerary confirmation
negative,1.0,@USAirways what's up with flight 5545 no gate agent or plane at PHX B18?  Nice customer service.,up flight no_gate agent plane phx b ? nice customer service
negative,1.0,@united Apparently they are asking 20 people to off board the plane--how can such a big miscalculation be made?!,apparently ask people off board plane big miscalculation make ? !
negative,1.0,@united 4595. We are now going back to the gate b/c of something overheating after sitting out here for 3+ hours.Love United but this stinks,go back gate b c something overheat sit out hour love unite stink
negative,1.0,@united Bos-SF was in between waivers. Business Cancelled Flighted due to weather before/after. No flexibility/compassion in extreme circumstances = 😔,bos sf waiver business cancel flight due weather no_flexibility compassion extreme circumstance pensive_face
neutral,0.6905,@SouthwestAir please reply to my DM ♥️,please reply dm heart_suit
neutral,0.3592,@JetBlue I'd go to Australia to enjoy the land down under! Always been on my bucket list! #FlyingItForward,would go australia enjoy land down ! always bucket list ! flyingitforward
negative,1.0,@SouthwestAir Had a bad experience with them last week.  They broke my bicycle that I had brought with me to do a bike ride in Fla.  Why?,bad experience last week break bicycle bring bike ride fla ?
positive,1.0,@JetBlue heading to Buffalo... trading the cold in Boston for colder in Buffalo... Maybe the Caribbean next time?,head buffalo trading cold boston colder buffalo maybe caribbean next time ?
negative,1.0,@AmericanAir after all that weve been through today as a courtesy to not allow a passenger with an oxgen tank sit up there is bad business,today courtesy not_allow passenger oxgen tank sit up bad business
negative,1.0,"@united to recap, you bounced me off my flight, LIED TO ME, then hung up on me. What am I supposed to think/do now?",recap bounce off flight lie hung up suppose think ?
negative,1.0,@united @rayja9 flying to las vegas out of Chicago flight is Late Flight and no announcement has been made,fly la vega out chicago flight late flight no_announcement make
negative,1.0,@USAirways my sister was supposed to leave at 10 am to go back to AL. She's only getting to NC now. Are you kidding me #NeverflyUSairways 👿,sister suppose leave go back al get nc kidding neverflyusairways angry_face_with_horns
negative,1.0,@VirginAmerica at Logan airport and waiting to checkin for my 9am flight. Checkin desk not open !!!!! Why?!,logan airport wait checkin flight checkin desk not_open ! ! ! ! ! ? !
neutral,0.6204,@united I need a customer service manager to contact me please,need customer service manager contact please
negative,1.0,@united system failure again = bad trend.  Software projects are like flying an airplane; there's no such thing as an emergency takeoff.,system failure bad trend software project like fly airplane no_such thing emergency takeoff
negative,0.6764,@AmericanAir do you have the phone number of a supervisor i can speak to regarding my travels today,phone number supervisor speak regard travel today
negative,1.0,@united I am trying to book awards for September and need flights on @aegeanairlines but they will not show even w/ many award seats availab,try book award september need flight will_not_show even w many award seat availab
negative,0.664,@united screwed over my professor. Maybe we should tell everyone about @Skiplagged ? #aviation #airport #airline #innovation #startups #tech,screw over professor maybe tell everyone ? aviation airport airline innovation startup tech
negative,0.6907,@united Why have you never held a plane for me? #HourDelay #MultipleDoorOpeningAndClosing #DangerOfGettingSnowedIn,never_held plane ? hourdelay multipledooropeningandclosing dangerofgettingsnowedin
negative,1.0,@AmericanAir My flight 1389 from Las Vegas to DFW was Cancelled Flightled! I've been on hold forever and I still have not spoken to anyone! Pls Help,flight la vegas dfw cancel flightled ! hold forever still have_not_spoken anyone ! pls help
negative,1.0,"@AmericanAir why does your customer service line say ""we are experiencing high call volume"" and then spontaneously hangup on the person?",customer service line say experience high call volume spontaneously hangup person ?
negative,0.6669,"@JetBlue absolutely. The missed connection caused us to miss our ferry to Vieques. Get us to Vieques. Also, flight vouchers. #PRBound",absolutely miss connection cause u miss ferry vieques get u vieques also flight voucher prbound
neutral,1.0,@united Greetings. UA Club member here. Any idea if I can use the Air Canada Lounge at YVR. Flying UA tomorrow.,greeting ua club member idea use air canada lounge yvr fly ua tomorrow
neutral,1.0,@SouthwestAir did you pick the winners for the #DestinationDragons ?? #87yearsLate Flightr #maybeijustlost #whyyounoloveme,pick winner destinationdragons ? ? yearslate flightr maybeijustlost whyyounoloveme
negative,0.6611,"@SouthwestAir #1687 MDW-SAN. Like most flights, if I'm watching free TV it works but won't hardly access any websites - including your own.",mdw san like flight watch free tv work will_not_hardly access website include
negative,1.0,"@SouthwestAir Redeem-points packages magically gone by time we finally got through @ 10:01, felt like #baitandswitch",redeem point package magically go time finally get felt like baitandswitch
negative,0.7109,@USAirways doesn't want me to get home,does_not_want get home
neutral,0.6821,@JetBlue nope. Currently sitting at my gate.,nope currently sit gate
negative,1.0,@united i did but i got nothing from it. Just dissapointment =(,get nothing dissapointment
negative,1.0,"@united in other words... sorry, not sorry.  Plenty of other airlines... and I travel A LOT.",word sorry not_sorry plenty airline travel lot
negative,1.0,@USAirways might possibly be THE WORST airline ever! I think it's time to brush up on customer service! #sorude,might possibly worst airline ever ! think time brush up customer service ! sorude
negative,0.6737,@USAirways and I can't get through on any phones,cannot_get phone
neutral,1.0,"@SouthwestAir @ClinicPolly 
Thank you-- I may have already responded but was 8UXZJ2",thank may already respond uxzj
positive,1.0,@SouthwestAir @DreSparkles Thank you! I finally made it to my destination,thank ! finally make destination
neutral,1.0,@JetBlue what is the name of this tailfin? http://t.co/qxV45MV0Ug,name tailfin ?
negative,1.0,@AmericanAir AA 2258 why have you Cancelled Flightled our flight without courtesy of notifying us or alternatives?  Very poor.,aa cancel flightled flight without courtesy notify u alternative ? very poor
negative,1.0,"@SouthwestAir everyone deserves red carpet tx until they destroy your luggage &amp;only give you $75 voucher, like I want to fly w/them again!",everyone deserve red carpet tx destroy luggage amp give voucher like want fly w !
negative,0.6818,@AmericanAir Nice AA employee making skillful excuses about Late Flightness due to catering snafu... http://t.co/YPVPVdlTYs,nice aa employee make skillful excuse late flightness due catering snafu
negative,1.0,@USAirways Need help with a flight. Weather + funeral = tough combination. On hold for over an hour. Please?,need help flight weather funeral tough combination hold over hour please ?
negative,1.0,"@AmericanAir so if your genuine, give me your opinion  on what occurred last night 445 fly  from phl, to mia. No assistance at airport",so genuine give opinion occur last night fly phl mia no_assistance airport
