airline_sentiment,sentiment_confidence,text,clean_text
neutral,1.0,.@VirginAmerica If only you guys were starting those flights at the end of the month! Guess I’m still road tripping on Feb 27…,guy start flight end month ! guess still road trip feb
negative,1.0,@AmericanAir.If I miss saying goodbye to my friend cause of your crappy service I swear you will never hear the end of it.#AmericanAirlines,miss say goodbye friend crappy service swear never_hear end americanairlines
negative,1.0,"@united Missed UA1568 connection due 2 mechanical failure UA1543 (""uplink prob""). I will lose ~$400 in clients Mon. How can you compensate?",miss ua connection due mechanical failure ua uplink prob lose client mon compensate ?
neutral,0.6542,@SouthwestAir #DestinationDragons iD is my favorite band and i met my 2bestfriends thanks to them! it would be life changing to see them!,destinationdragons id favorite band meet bestfriends thanks ! would life change see !
neutral,1.0,@SouthwestAir @geekstiel Do you know when the last chance is?,know last chance ?
negative,1.0,@AmericanAir how can I get travel question answered quickly... Online and calling not helping with this busy day,get travel question answer quickly online call not_helping busy day
negative,1.0,@USAirways #stuck in Florida with no flights... Service sucks here. #nofood #nodrinks #nohelp,stick florida no_flights service suck nofood nodrinks nohelp
negative,1.0,@USAirways but my bag is still missing,bag still miss
negative,1.0,@AmericanAir “Inconvenient” is such a convenient word.,inconvenient convenient word
negative,0.679,@united that's not even an apology,is_not_even apology
positive,1.0,@SouthwestAir @AmericanAir y'all are better then @united,better
negative,1.0,@USAirways Seriously? I should keep trying after seven hours. That is your corporate policy? #usairwaysfail,seriously ? keep try seven hour corporate policy ? usairwaysfail
negative,1.0,@united is 4:30am and I am in the customer service line trying not to scream. #epicfailunited,customer service line try not_to scream epicfailunited
neutral,1.0,@united - it is possible to make a ticket change via Twitter? Traveling internationally and can't make calls... Thanks in advance!,possible make ticket change via twitter ? travel internationally cannot_make call thanks advance !
positive,1.0,"@SouthwestAir Once again, I was able to change my flight without any fees... oh and the two free checked bags.  Best airline ever.",able change flight without fee oh two free check bags best airline ever
negative,1.0,"@SouthwestAir A-list preferred line phone wait was 15 minutes. I hung up, not feeling A-list-ey!",list preferred line phone wait minute hang up not_feeling list ey !
negative,0.6778,"@USAirways yep, check it and my gmail 'Promotions' folder regularly... :-(",yep check gmail promotion folder regularly
negative,1.0,@USAirways was on hold for about 45 minutes after speaking 2 lady at the airport counter. Gave up,hold minute speak lady airport counter give up
negative,1.0,"@JetBlue Am I the only one who had to look that up? I must be getting old...
 #damn",one look up ? must get old damn
negative,1.0,@USAirways US 728/Feb 21. Arrive 7 hrs Late Flight; checked car seat missing. No replacement available. Has yet to arrive more than 24 hours Late Flightr.,u feb arrive hr late flight check car seat miss no_replacement available yet arrive hour late flightr
negative,1.0,@SouthwestAir 3 + hrs w/out bags being returned to us after flight 2464 Cancelled Flightled. Maybe put a couple people on it?,hr w out bag return u flight cancel flightled maybe put couple people ?
negative,1.0,"@SouthwestAir have you considered adding the ""we'll call you back when we have someone free"" feature to your support line?",consider add call back someone free feature support line ?
positive,1.0,@AmericanAir in miami and the  agents Rachel Wong and Marisol Pimentel were very  pleasant in a world of chaos a BIG .thank u,miami agent rachel wong marisol pimentel very pleasant world chaos big thank
neutral,1.0,@SouthwestAir do you have any info about when #DestinationDragons winners will be announced? me &amp; my best friend are hoping to win. thanks!,info destinationdragons winner announce ? amp best friend hop win thanks !
neutral,1.0,@united does forelock guarantee the fare only or fare &amp; seats?,forelock guarantee fare fare amp seat ?
negative,1.0,"@AmericanAir leave us stranded, send baggage with important medication to different city for 4days&amp;apologise with a $50 voucher. appalling.",leave u stranded send baggage important medication different city day amp apologise voucher appal
negative,1.0,@USAirways any way to get your call center to answer for a OneWorld award? Whenever try system says too busy and disconnect or endless hold,way get call center answer oneworld award ? whenever try system say too busy disconnect endless hold
negative,1.0,@united can you maybe have more than 1 person working customer service desk in Houston airport? Line 3 rows deep 1 person working,maybe person work customer service desk houston airport ? line row deep person work
positive,1.0,"@JetBlue's #ValentinesDay email was on point &amp; so clever! Thanks for being amazing, #JetBlue! #loveisintheair http://t.co/DoCmvoTWTI",valentinesday email point amp so clever ! thanks amaze jetblue ! loveisintheair
negative,0.6657,Jet BOOOO 🍅🍅🍅🍅 RT @JetBlue: Our fleet's on fleek. http://t.co/0WbJAWx7xD,jet boooo tomato tomato tomato tomato rt fleet fleek
neutral,0.6553,@AmericanAir 3198 to AEX. Is it still going?,aex still go ?
negative,1.0,@SouthwestAir I paid for inflight wifi only for it not to work. Download speed was 0.21mbps &amp; I ended up watching the free TV instead.,pay inflight wifi not_to work download speed mbps amp end up watch free tv instead
neutral,1.0,@JetBlue @markie_post I'd like to see Markie too.,would like see markie too
negative,1.0,@USAirways enormous lines at customer service and two agents what kind of service is that .. http://t.co/ffanixJhwh,enormous line customer service two agent kind service
negative,1.0,@united on flight 1665 but it's not departing! Website says delayed due to operational difficulties-what does that mean?,flight is_not_departing ! website say delay due operational difficulty mean ?
negative,1.0,@united Outbound 2 bags 70 lbs bags Returning home 1 bag 50 lbs. What is your logic? And WHY? Am I writing to a Machine? Human HELP required,outbound bag lbs bag return home bag lb logic ? ? write machine ? human help require
neutral,1.0,@united I went from Sacramento to Minneapolis at the end of October 2014 in business class.,go sacramento minneapolis end october business class
negative,1.0,@AmericanAir @USAirways and the way I have been spoken to by #DFW and #Mia employees is truly disgusting. Save the pain fly with anyone else,way speak dfw mia employee truly disgust save pain fly anyone else
negative,1.0,@USAirways has the most ass backwards process for using credits on flights. even trying to get a hold of customer relations is impossible,as backwards process use credit flight even try get hold customer relation impossible
negative,1.0,"@united after a Cancelled Flighted flight, and 2 delays, you lost my luggage AGAIN! You're the WORST! Disgraceful! Awful company, horrible service!",cancel flighted flight delay lose luggage ! worst ! disgraceful ! awful company horrible service !
negative,1.0,@AmericanAir that is absolutely false stmt.  You have a comedy of errors incl no catering etc #GetYourActTogether,absolutely false stmt comedy error incl no_catering etc getyouracttogether
neutral,0.6426,@SouthwestAir I would love to go to the #DestinationDragons @ImagineDragons show tomorrow in Utah at @VelourLive! I've been trying so hard.,would love go destinationdragons show tomorrow utah ! try so hard
neutral,1.0,@SouthwestAir can you follow and we'll proceed?,follow proceed ?
neutral,1.0,@JetBlue I believe that the website said I could receive credit for upcoming flights since I Cancelled Flighted my last one. Is this true?,believe website say could receive credit upcoming flight since cancel flight last one true ?
neutral,1.0,@USAirways did you know that suicide is the second leading cause of death among teens 10-24,know suicide second lead death among teen
negative,0.6706,"@united I'm fully aware, it's just that your rules are harsh toward the client. Especially since you're going to resell my seat for more $.",fully aware rule harsh toward client especially since go resell seat
negative,1.0,@united Extremely disappointed in #Flight6831. United left crew and pssgrs stranded in rain @ gate with no cover. Left Psngrs 2 depart plane,extremely disappointed flight united leave crew pssgrs strand rain gate no_cover leave psngrs depart plane
neutral,0.6787,@SouthwestAir can take u to Midway-Chicago March 8th-April 6th. Can't make it then? @AmericanAir can get u to @fly2ohare year round. #FlyPBI,take midway chicago march th april th cannot_make ? get year round flypbi
neutral,1.0,@AmericanAir flights out of Dallas on Tuesday are not going to be Cancelled Flightled correct?,flight out dallas tuesday are_not_going cancel flightled correct ?
negative,1.0,@AmericanAir were stuck on a plane in Dallas that's supposed to be going to Okc. There's an issue w/ the plane. Any idea on how much longer?,stuck plane dallas suppose go okc issue w plane idea much longer ?
neutral,1.0,@USAirways and I would have been willing to give him the benefit of the doubt and say we misunderstood each other until he went on a,would willing give benefit doubt say misunderstood go
negative,1.0,"I've been trying to set up my phone interview for days, and hoping the position won't be filled because the link doesn't work. @USAirways",try set up phone interview day hop position will_not_be fill link does_not_work
negative,1.0,"@JetBlue come on! Already delayed 2+ hrs on flight 1415 as we waited for the pilot to come from Boston, now you reassign him?! Endless trip.",come ! already delay hr flight wait pilot come boston reassign ? ! endless trip
positive,1.0,@JetBlue OH YEAH!!! great flight down to Mexico with a wonderful crew!! Thank you!!,oh yeah ! ! ! great flight down mexico wonderful crew ! ! thank ! !
negative,1.0,@united no they were to busy taking to each other and I needed to get to an audition.,no_they busy take needed get audition
negative,1.0,.@SouthwestAir thx for the note. Flight was Cancelled Flightled and today is all booked so had to go with another carrier. :(,thanks note flight cancel flightled today book so go another carrier
negative,1.0,@united--excited to barrel through the sky at 600mph on a 75 ton piece of metal operated by a company that can't get their tiny TVs to work!,excited barrel sky mph ton piece metal operate company cannot_get tiny tvs work !
neutral,0.6637,"@united roundtrip tickets to NJ are DRAMATICALLY cheaper through Virgin, pretty pricey via United. Can you match them?",roundtrip ticket nj dramatically cheaper virgin pretty pricey via united match ?
neutral,0.6368,"@SouthwestAir For my Grandma Ella's 80th, she would love a bday greeting from your flight crew! She was a stewardess for Eastern Airlines.",grandma ella th would love birthday greet flight crew ! stewardess eastern airline
negative,1.0,@USAirways I tried reaching out to you guys I'm running out time and patience I just want my flight to be honor and I want a confirmation!,try reach out guy run out time patience want flight honor want confirmation !
negative,1.0,"@united your gate attendant had some snobby remarks, your customer service is like playing poker with my sisters kids!",gate attendant snobby remark customer service like play poker sister kid !
negative,1.0,@USAirways - thanks however I feel like the system has failed me -- what is the solution?,thanks however feel like system fail solution ?
negative,1.0,@USAirways not Cancelled Flightling #837 because you don't want to put us in a hotel for night is our guess,not_cancelled flightling do_not_want put u hotel night guess
neutral,1.0,“@USAirways: @AnnetteNaif We appreciate the #shoutout for Roberto. DM your confirmation code so we can forward your kind words.” sent,appreciate shoutout roberto dm confirmation code so forward kind word send
neutral,1.0,@SouthwestAir reference #: 261093929756,reference
positive,1.0,@SouthwestAir Got it covered. Thanks!,get covered thanks !
negative,1.0,"@united If someone misses his connecting flight because of the airline, and it was the last flight of the day, how will you fix it?",someone miss connect flight airline last flight day fix ?
neutral,1.0,@JetBlue flight 1183 to Orlando.,flight orlando
negative,1.0,".@SouthwestAir glad you appreciate it, it’ll be the last dollar you ever get from me thanks to your wretched customer service",glad appreciate last dollar ever get thanks wretched customer service
negative,1.0,@USAirways @BohnJai they lost my bag @PHL baggage handlers broke open my bag and stole my camera,lose bag baggage handler break open bag stole camera
neutral,0.6907,@SouthwestAir is America's largest airline by passengers carried! Wonder if this is b/c they have a 'Customer Service Bible' #ANAmarketers,america largest airline passenger carry ! wonder b c customer service bible anamarketers
neutral,0.3456,@JetBlue You guys need pillows on these rockers to really knock it out of the park ... just sayin ...,guy need pillow rocker really knock out park sayin
neutral,1.0,"@VirginAmerica @VirginAtlantic @GMA @AmericanAir 
Can You Help #ourprincess in need of some help in #USA 
🎀🇬🇧🎀🇺🇸🎀 http://t.co/778AzTDaer",help ourprincess need help usa ribbon united_kingdom ribbon united_states ribbon
negative,1.0,@united please stop spending mktg $ on branding ads. Use savings to improve #cxp. 1hr wait for luggage due to short staff is unacceptable,please stop spending mktg brand ad use saving improve cxp hr wait luggage due short staff unacceptable
negative,1.0,@SouthwestAir What's up with the wait times on your customer service line? Tried 2X on Fri. and now I've been on for over 15 min.,up wait time customer service line ? try x fri over min
negative,1.0,@united we are sitting on the runway for 2 hours! It is ridiculous!!,sit runway hour ! ridiculous ! !
negative,1.0,@JetBlue @fllairport best way to kill nine hours at the airport when all flights are full and the airline won't put you standby? #stranded,best way kill nine hour airport flight full airline will_not_put standby ? strand
neutral,0.6726,"@SouthwestAir easy fix, let the business select actually board 1st, then board the pre-boards...",easy fix let business select actually board st board pre board
negative,1.0,@united I will be patient in my luxurious middle seat on my next delayed flight,patient luxurious middle seat next delayed flight
negative,1.0,@SouthwestAir  been on hold  for 2 1/2 hrs. Can't get 2 airport 4 flight icy country backroads! Help pls? @SouthwestAir  #BNA,hold hr cannot_get airport flight icy country backroads ! help pls ? bna
neutral,0.6747,@SouthwestAir how can I check to see if my flight to NYC is expected to be delayed or Cancelled Flightled for this Tuesday?,check see flight nyc expect delayed cancel flightled tuesday ?
neutral,1.0,@USAirways Hi-i have a travel question. Could you please follow me so i can dm you?,hi travel question could please follow so dm ?
negative,1.0,@USAirways no wonder you are the lowest rated airline in america. #shameful #USAirways,no_wonder lowest rat airline america shameful usairways
negative,1.0,"@united so you told me to go, knowing what the issue was, only for me to go there and find out that you won’t fix it?",so told go know issue go find out will_not_fix ?
negative,1.0,@USAirways Travelling from pwm to atl on Sunday That flight got Cancelled Flightled and my new flight is Cancelled Flightled and got disconnected when reFlight Booking Problems,travel pwm atl sunday flight get cancel flightled new flight cancel flightled got disconnect reflight book problem
positive,0.7172,"@SouthwestAir I love imagine dragons o flipping much, pls #DestinationDragons",love imagine dragon flip much pls destinationdragons
negative,1.0,@JetBlue Why are you making it so freaking hard for me to say good things about you??  #jetbluefail http://t.co/v8SB0RBICx,make so freaking hard say good thing ? ? jetbluefail
neutral,1.0,@USAirways what's going on in CLT?,go clt ?
neutral,0.6598,@AmericanAir Both pictures taken at the same time but which is right? #totallyconfused http://t.co/dvSLtQZKmQ,picture take time right ? totallyconfused
negative,0.6925,@virginamerica how's a direct flight FLL-&gt;SFO have unexpected layover in Vegas 4 fuel yet peeps next to me bought for Vegas flight. #sneaky,direct flight fll gt sfo unexpected layover vegas fuel yet peeps next bought vega flight sneaky
negative,1.0,"@SouthwestAir I'm an A-list Preferred customer and very loyal SWA. However, your inflight wifi is no better today than it was 4 years ago.",list preferred customer very loyal swa however inflight wifi no_better today year ago
negative,1.0,"@united This must be a drone “@united: @KeamBleam We understand your frustration. Our Bag team is working hard to get your bag(s) to you...""",must drone understand frustration bag team work hard get bag
negative,0.7077,"@united yep—used that twice; no case id numbers assigned; just tried it again-get screen that says, “thank you for submitting your request”",yep use twice no_case id number assign tried get screen say thank submit request
positive,1.0,@united thanks for moving my dad on to my my mom's flight. You helped make his birthday start with #FriendlyFriday Awesomeness! 4 paws up!,thanks move dad mom flight help make birthday start friendlyfriday awesomeness ! paw up !
positive,0.6632,@SouthwestAir @love_dragonss lol I'm sorry I'm just seeing this now but LAUREN OH MY GOD AHHHH,lol sorry see lauren oh god ahhhh
positive,0.6481,@SouthwestAir telling my Fam in Vegas now. :),tell fam vega
neutral,0.6633,"@AmericanAir two were non revs, right?",two non rev right ?
negative,1.0,@USAirways delayed depart bc ur flight attendant wasn't there. Then after landing took 3 hrs to get a gate. Now it's another he and NO bags,delay depart flight attendant was_not_there land take hr get gate another no_bags
negative,1.0,"@united @airlines. Agents arguing about check bag announcement. Looked for room until seat 20, gave up and walked back to seat 7.Unnecessary",agent argue check bag announcement look room seat give up walked back seat unnecessary
positive,0.6667,"“@JetBlue: @2littlebirds Well captured, Brittany! We love the clouds! :)  Enjoy the ride!” Thank you!",well capture brittany ! love cloud ! enjoy ride ! thank !
neutral,0.6891,@united So do I need to book two one ways in order for her to fly as an unaccompanied minor?,so need book two one way order fly unaccompanied minor ?
neutral,0.6763,@United to operated #B767-300ER from #Newark to #Zurich @ZRH_airport replacing B767-400ER between 6MAY-23SEP instead till 23OCT #avgeek,operate b er newark zurich replacing b er may sep instead till oct avgeek
negative,1.0,@USAirways Don't blame it on weather. Rep at counter cost me entire day - not weather.  Printed Boarding Pass too Late Flight. #TakeResponsibility,do_not_blame weather rep counter cost entire day not_weather print boarding pas too late flight takeresponsibility
neutral,0.3428,@united S/O to @Delta for coming in clutch and finally taking me home 🙌🙌,come clutch finally take home raising_hands raising_hands
positive,1.0,@USAirways landed safely everything worked out.,land safely everything work out
negative,0.6794,@USAirways  thanks! Now I just need to locate where my luggage is!,thanks ! need locate luggage !
negative,1.0,@united customers ✅. Customer service ❌ http://t.co/qP6Aw3nLIP,customer check_mark_button customer service cross_mark
negative,1.0,@USAirways well then that is a horrible flaw in your system. 2 hours in the past day I've wasted. I've got a job &amp; family this is crazy,well horrible flaw system hour past day waste get job amp family crazy
negative,1.0,@USAirways why would you not give us the option to get off the plane instead of sit on it for an hour and a half when you knew at the gate,would not_give u option get off plane instead sit hour half know gate
neutral,1.0,@SouthwestAir when does today's scavenger hunt start? I'm trying to help my little brother win! #DestinationDragons,today scavenger hunt start ? try help little brother win ! destinationdragons
negative,1.0,@USAirways HORRIBLE communication on delayed flight out of LGA!!!! I got 2 emails in seconds w different delay times!!!! HORRIBLE,horrible communication delay flight out lga ! ! ! ! get emails second w different delay time ! ! ! ! horrible
negative,1.0,@united I think problem resolution should be decided on your end. Especially if you'd like me to continue flying your airline.,think problem resolution decide end especially would like continue fly airline
positive,0.6406,@SouthwestAir thanks connection thru Nashville have A1 boarding pass get to Dallas gate boarding 40 min before flt get end of B group,thanks connection thru nashville board pas get dallas gate boarding min flt get end b group
negative,1.0,@AmericanAir  800 number will not even let you wait for next customer rep. Very frustrating. Can't talk to humans.,number will_not_even let wait next customer rep very frustrating cannot_talk human
negative,0.6275,@AmericanAir Hopefully you guys are willing to cover my lovely car rental and living charges...I love being here for two extra days..,hopefully guys willing cover lovely car rental living charge love two extra day
positive,1.0,@united awesome new plane flight 1701,awesome new plane flight
negative,1.0,@USAirways your customer service at CLT is terrible!!! My flight was delayed from JFK for 2 hours!  Get to CLT to horrid customer service!,customer service clt terrible ! ! ! flight delay jfk hour ! get clt horrid customer service !
negative,1.0,@SouthwestAir I'm stuck in Fort Lauderdale.,stuck fort lauderdale
neutral,0.6709,@AmericanAir I don't think you should help him at all based on his behavior. The voucher and cot seem like enough lol 😃,do_not_think help base behavior voucher cot seem like enough lol grinning_face_with_big_eyes
positive,0.6559,"@virginamerica Well, I didn't…but NOW I DO! :-D",well did_not_but !
negative,1.0,@USAirways Never mind that you could have told the gate I was on my way - you could delay 10 mins but not 15?,never_mind could tell gate way could delay min not ?
positive,1.0,@JetBlue sounds great! Thank you!! :),sound great ! thank ! !
negative,1.0,@AmericanAir 1416 Cancelled Flightled? Can't get out for two days? No explanation?,cancel flightled ? cannot_get out two day ? no_explanation ?
positive,1.0,@united counter agents at RDU deserve a medal. #thankyou,counter agent rdu deserve medal thankyou
negative,1.0,@AmericanAir has no customer service via phone or in person. Just a stone wall with a giant middle finger painted on it.,no_customer service via phone person stone wall giant middle finger paint
neutral,0.6601,@united how are conditions in BOS today? I'm in UA994. Everything appears to be in time but I wanted to check.,condition bos today ? ua everything appear time want check
negative,1.0,@united still sucks. I don't understand why you have two cust service agents for a long line at Houston international b gate #unitedsucks,still suck do_not_understand two cust service agent long line houston international b gate unitedsucks
negative,1.0,@usairways im trying to get my dads wheelchair and no one is answering at Dulles.we have tried to call back on.multiple times,try get dad wheelchair no_one answer dulles try call back multiple time
negative,1.0,"@AmericanAir i ordered it as i always do. But on a 9hour flight delayed for 4 hours, it was worse than ever before when you forgot my meal.",order always hour flight delay hour worse ever forget meal
negative,1.0,@USAirways The automated message isn't helpful and it's impossible to speak with a human right now. Desperately need our luggage :(,automate message is_not_helpful impossible speak human right desperately need luggage
negative,1.0,"@JetBlue can't link my flight from last week to my TruBlue account and 1800 num isn't answering..don't make me fly @Delta again, dont do it!",cannot_link flight last week trublue account num is_not_answering do_not_make fly do_not_do !
positive,1.0,@SouthwestAir much respect!,much respect !
negative,1.0,"@JetBlue - I did, but since I was stranded in SYR without a ride I missed the window of opportunity to have rights in this matter. (4 hours)",since strand syr without ride miss window opportunity right matter hour
negative,1.0,@JetBlue there were seats but after waiting on hold for 20 minutes they were gone-now she has to stay another night in charleston-very pricy,seat wait hold minute go stay another night charleston very pricy
negative,1.0,@AmericanAir the most stressful morning and still had to pay to check a bag. LAX is a madhouse with a lot of angry customers. Yikes,stressful morning still pay check bag lax madhouse lot angry customer yikes
neutral,0.6923,"@JetBlue For my Grandma Ella's 80th, she would love a birthday greeting from your flight crew! She was a stewardess for Eastern Airlines.",grandma ella th would love birthday greet flight crew ! stewardess eastern airline
negative,1.0,@united  Serious firing needs to happen at HNL. They broke the wheelchair you loaned me after you broke mine! http://t.co/bT37KyrByJ,serious fire need happen hnl break wheelchair loan break mine !
positive,1.0,@AmericanAir Aww Thanks AA..DFW was on GMA up here this AM..so i understand ..Btw A.A is my Airline when im able to trv..Love you guys.:),aww thanks aa dfw gma up so understand way airline able trv love guy
